CommentId,Comment,PublishedTimeText,PublishedTime,AuthorName,AuthorChannelId,AuthorIsVerified,AuthorIsCreator,AuthorAvatarUrl,AuthorChannelUrl,Likes,Replies,Type
UgyBvQoHej13gER2yah4AaABAg,"sd di kampung gw aja blm ada ni program, pemerintah malah fokusin ke daerah kota bukan fokusin ke daerah pelosok dulu","1 year ago",2025-06-22T11:53:10.948Z,@mesky.,UCdGLc5bSzqagnCVfeLQccBA,0,0,https://yt3.ggpht.com/4ZiGrAYIKwVdI_Z0ckyXplGdfwMMeTRzzBoE_hclKUFMOdwlEldyNlesg3uYUasqZLSQVScYtjQ=s88-c-k-c0x00ffffff-no-rj,https://www.youtube.com/channel/UCdGLc5bSzqagnCVfeLQccBA,18,3,comment
UgzasV8Qx4_9ak-HNzZ4AaABAg,"kalo mau kontra sama orang, jangan orang lain yang kalian adu domba.

emang dasarnya netijing indo ini suka banget adu domba orang lain.

lucunya ampe nyuruh buat ""lepas label close the door sebagai bukti kalau elu satu suara ama kita!"" 😂😂 kocak kata gw mah. kalo mau protes ama orang ya protes aja secara langsung. jangan sampe diadu-adu gitu orang lain cok!

kalian lepas dari konsekuensi kalo seandainya om dedi dan bg ferry itu musuhan layaknya livy dan om ded 2.0 . emang kalian peduli klao mereka musuhan ? sebagian besar pasti nggak sih wkwk","1 year ago (edited)",2025-06-22T11:53:11.348Z,@balonsaya.ada5,UCldRgwBcPIQeHZeq67WsuZQ,0,0,https://yt3.ggpht.com/M1JkDvdIXjqJ8jJ0NH41HX9VGi7d_zk3TE6IbpKzFnjggtCpNoP06OnBFz2SGhoSUSG8hwHc=s88-c-k-c0x00ffffff-no-rj,https://www.youtube.com/channel/UCldRgwBcPIQeHZeq67WsuZQ,32,4,comment
Ugzx8vsKb9fWrvqX5ZV4AaABAg,"kita harus mulai belajar untuk mengatakan yang salah ya salah, yang benar ya benar. Kritik juga harus pada tempat dan sesuai, jangan ngasal....","1 year ago",2025-06-22T11:53:11.348Z,@4rayD,UCq0yGd5PVV0W8rvdZL4Pa9w,0,0,https://yt3.ggpht.com/ytc/AIdro_mlL5bZQezsCQ9nI8tHz9UxXTGO_tC8Si_Lxzgelrg=s88-c-k-c0x00ffffff-no-rj,https://www.youtube.com/channel/UCq0yGd5PVV0W8rvdZL4Pa9w,0,0,comment
UgxMykGIl6CIX5KeLON4AaABAg,"2:28 setuju😢","1 year ago",2025-06-22T11:53:11.348Z,@bakamons21,UCrz3woBesUjochia7r-Nx1g,0,0,https://yt3.ggpht.com/ytc/AIdro_kLOhioTN2sYzACJNma-8jBUm83trXepJXvrXtiIxALBA=s88-c-k-c0x00ffffff-no-rj,https://www.youtube.com/channel/UCrz3woBesUjochia7r-Nx1g,6,1,comment
UgzUyzo4DkBjQgKe5Yl4AaABAg,"Terlebih dari segala kekurangannya, gw suka ngeliat efek sosial siswa di sekolah krn program MBG ini. Mereka bisa makan bareng dikelas dengan menu yg seragam. Jadi ga ada yg minder krn makannya kalah mewah dibandingin siswa yg lain atau yg makan sendiri di belakang sekolah. Terus juga siswa jadi berfikir dua kali buat bolos, rugi lah bolos ga dpt makan siang gratis, klo bolos keluar ongkos kan tuh. 

Semoga aja ada evaluasi, semakin dibenahin manajemen dan birokrasi program ini dan harus benar2 dikawal masyarakat program ini","1 year ago",2025-06-22T11:53:11.348Z,@monsterbuster93,UCyR7nauKkecdZI9wgR5fEaw,0,0,https://yt3.ggpht.com/QBXNlnUY-lN6P-i8EQrXT33dxw_bECothfT8MvAbjwPEl2a7W3ahrk5N_fj8fsNyBoHOz2Ql=s88-c-k-c0x00ffffff-no-rj,https://www.youtube.com/channel/UCyR7nauKkecdZI9wgR5fEaw,17,6,comment
UgzpvBScF0sx4z9Ysd54AaABAg,"Yg di pelosok kayaknya harus diutamakan dulu sih","1 year ago",2025-06-22T11:53:11.348Z,@AwiSahlul,UCpvQYERed7SZZTK2mZiimSg,0,0,https://yt3.ggpht.com/z_Z9vOYA0crwOqHw1h3pZTgC4UKSMQGxrGf_ONWOL63Koorhy7gypphxMuhrGpeoWPJQuDH-gUA=s88-c-k-c0x00ffffff-no-rj,https://www.youtube.com/channel/UCpvQYERed7SZZTK2mZiimSg,1,0,comment
UgzayvYt5oE7BGp2OS54AaABAg,"Tujuan makan siang gratis untuk meningkatkan gizi bukan untuk meningkatkan rasa syukur....","1 year ago",2025-06-22T11:53:11.348Z,@jeriAndes-s4t,UCJQEwJtKzRHSUU9f83DJYCg,0,0,https://yt3.ggpht.com/lGDw79O9rq6vIc0drA5SX24vCFkN3CcTyWX4xCXJMJUGDPZXgxeXmuoEUiV8_-z-9-nWXmdbGXY=s88-c-k-c0x00ffffff-no-rj,https://www.youtube.com/channel/UCJQEwJtKzRHSUU9f83DJYCg,16,3,comment
UgzBu1hPcqxcZQa8ebt4AaABAg,"Bang saya siap kerja hapus hapusin komen judol","1 year ago",2025-06-22T11:53:11.348Z,@ayanosamsul6503,UCGHgQkPaMIlOqxyS_QsVsFA,0,0,https://yt3.ggpht.com/qSZLDgFl8OLgReAX7L-WKF-hJuHE8XvZYebWn7gPEwKbvy27n7I75aKJduutRPV9JoH5L9gNSUQ=s88-c-k-c0x00ffffff-no-rj,https://www.youtube.com/channel/UCGHgQkPaMIlOqxyS_QsVsFA,4,0,comment
Ugx-MjqHSZE4phI1YIx4AaABAg,"Dan yg menjadi korban dari makan siang gratis ini adalah makanan kantin sekolah yg mana menurunkan nilai ekonomi penjual di kantin","1 year ago",2025-06-22T11:53:11.348Z,@ValentinoGregorius,UCLQDt0gv7G8gq1g1oW-3cEg,0,0,https://yt3.ggpht.com/ytc/AIdro_kgpoo4vRQWZ7v_XumqsPMaDtrEjVX38RC7dyIMLxuy2D832dS0H_y2mFgsRDNPotjB3w=s88-c-k-c0x00ffffff-no-rj,https://www.youtube.com/channel/UCLQDt0gv7G8gq1g1oW-3cEg,1,0,comment
UgzzM94R_lu4Oymjw9t4AaABAg,"Gampangnya gini. 
Program Makanan Bergizi Gratis (MBG) adalah kebijakan yang dikeluarkan lembaga tinggi negara (Presiden). Kebijakan ini kemudian diaplikasikan ke masyarakat setelah melalui rantai distribusi, dengan bekerjasama dengan pelaksana, baik dalam artian sekolah maupun vendor makanan.

Keracunan makanan, porsi yang sedikit, ada yang belum matang dll. itu adalah kesalahan dalam level pelaksanaan, karenanya, kalau mau kritik, kritik sekolahnya atau vendor makanannya. 

Kalau dana makanannya di korupsi oleh pejabat terkait, maka ini adalah kesalahan di level management dan distribusi dana. Kalau mau kritik, kritik pejabatnya dan laporkan.

Kritik kebijakan tuh yang dikritik konsepnya, misalnya tentang sustainability kedepannya gimana? dananya gimana? Seperti yang dijelaskan di menit 8:33 tentang managemen fiskal.

Kebanyakan netizen, ngelihat kesalahan di level pelaksanaan trus dipakai untuk kritik level kebijakan, ya ga nyambung.","1 year ago",2025-06-22T11:53:11.348Z,@taurenchieftain3328,UCsaNykJHpzTIrWZH39lK-Ow,0,0,https://yt3.ggpht.com/ytc/AIdro_l_7Iaz6-H3T_pRf6hNXS3C5t98N5EPkQk4XYycflg=s88-c-k-c0x00ffffff-no-rj,https://www.youtube.com/channel/UCsaNykJHpzTIrWZH39lK-Ow,52,21,comment
Ugxy4FUlOHOS6v35dLx4AaABAg,"Saya dukung bung ferry jadi wapres buat gantiin el plongo fufufafa bin mulyono","1 year ago",2025-06-22T11:53:11.348Z,@pikrihendriawanmaulana8877,UCRLGP8aaK5a-9R-G7JJBplg,0,0,https://yt3.ggpht.com/zHGb01vAXnion6KX7RTlGIT343OWvZjlrqG7tPgU_MjEX_nym8IAz9ubYXjchluRYYilpJJUG8Y=s88-c-k-c0x00ffffff-no-rj,https://www.youtube.com/channel/UCRLGP8aaK5a-9R-G7JJBplg,7,0,comment
Ugz8CKkNAxe4dtfT6lt4AaABAg,"Ayo mas fery irwandi tolong suarakn makan beracun gratis diganti pendidikn gratis atw beras gratis k orag tua, biar pejabat gk kebanyakn mbulet","8 months ago (edited)",2025-10-22T11:53:11.348Z,@durotunnasikha1182,UCkwVvSztFBOG56l9VexweWg,0,0,https://yt3.ggpht.com/ytc/AIdro_mMna0eqTxI40bTYxEwnQ3fotkoOzfA5jyFEak676LLhHAOgKlANhBVH3zso3FiQTxzlQ=s88-c-k-c0x00ffffff-no-rj,https://www.youtube.com/channel/UCkwVvSztFBOG56l9VexweWg,1,0,comment
Ugwpy3X7fRxFlmrc8fd4AaABAg,"betul sekali,,,,di lasih ke kantin"" sekolah,,,komite sekolah,,libatkan wali murid/ ibu"" untuk ikut kerja masak dll,,,makana cepat sampai,,,g takut basi,,,,bs saling kontrol keuangan,,,,menunya,dan efisien biaya,,
jd negara gak ribet banget mubil"" buat angkut"" buang"" biaya","1 year ago",2025-06-22T11:53:11.348Z,@tiniektinnara8430,UCeIarMFzvLx_jBFr01ed1ug,0,0,https://yt3.ggpht.com/ytc/AIdro_kf4a2cV0kKKQ7n0hkTGzllfDAkCG4-bTzSuv1yTU8=s88-c-k-c0x00ffffff-no-rj,https://www.youtube.com/channel/UCeIarMFzvLx_jBFr01ed1ug,5,2,comment
Ugx56v3ZzKAAzgwcMb14AaABAg,"Gw salah satu orang yang setuju dengan program makan siang gratis, karena laper itu ngga enak. Kasian sama anak2 sekolah yang harus nahan laper pas belajar, gimana mau masuk itu pelajaran. Tapi kayaknya program ini terkesan terburu buru padahal banyak banget yang harus dipertimbangkan kayak mas ferry bilang. Anyway lebih sehat kita berdiskusi di channel youtube mas ferry karna kita jadi bebas berpendapat tanpa dituduh buzzer. Thanks mas ferry","1 year ago",2025-06-22T11:53:11.348Z,@RichardMacrae-d8y,UCQONNXTQzHW0RWJnv0lZpYw,0,0,https://yt3.ggpht.com/ytc/AIdro_mC-F_LUNsLxxHq0iRkdThSk-g8rlByJUfRPLo8n2HtbmB0G7VDfzswGgLJModTHVY6_A=s88-c-k-c0x00ffffff-no-rj,https://www.youtube.com/channel/UCQONNXTQzHW0RWJnv0lZpYw,5,0,comment
UgwOnar9KdtjgKguR2l4AaABAg,"Teknisnya semoga semakin lebih simple dan mengutamakan daerah yg kurang makan gizinya","1 year ago",2025-06-22T11:53:11.348Z,@ShanumNum-co4ln,UCXHhk2rT-_XdHfFJ0OIwbvA,0,0,https://yt3.ggpht.com/ytc/AIdro_naVtQgGqLR2mEJBYsUptJWeahbG_5vnBCPaDOqBcwUdRBL6bJjSCLq-kGRbS6uIBwmZQ=s88-c-k-c0x00ffffff-no-rj,https://www.youtube.com/channel/UCXHhk2rT-_XdHfFJ0OIwbvA,0,0,comment
UgyAgINGG4x1NXtvWYN4AaABAg,"3:29 serius anak sd ngomong kek gitu","1 year ago",2025-06-22T11:53:11.348Z,@wahyudinbeniardi9602,UCycAMz4zh1i5u83EGvv2JnA,0,0,https://yt3.ggpht.com/ytc/AIdro_msW2nkfauMFc7swHYRR7R-F9H_Po8aERMkCWDxu2hOU9Ux=s88-c-k-c0x00ffffff-no-rj,https://www.youtube.com/channel/UCycAMz4zh1i5u83EGvv2JnA,3,4,comment
Ugw7cGMvp01INhFt67t4AaABAg,"bahkan klip soeharto 2:58 lebih sopan drpd intimidasinya om botak","1 year ago",2025-06-22T11:53:11.348Z,@baytrisstudio6132,UCtaAPx_gRRnKC6B3tdHkgVQ,0,0,https://yt3.ggpht.com/ytc/AIdro_mrhJR-DVzM87-LzPo3TNXyHhjiJu9-hPjUNbAjInM=s88-c-k-c0x00ffffff-no-rj,https://www.youtube.com/channel/UCtaAPx_gRRnKC6B3tdHkgVQ,10,2,comment
UgwA_PiMcvDGM_A_HgR4AaABAg,"bagus kontennya ni, pas banget 10 menit saya selesai nonton selesai juga makan siangnya hahaha","1 year ago",2025-06-22T11:53:11.348Z,@StefanoTobing,UCy6NdzxY3vrDkFS9d2j4vMQ,0,0,https://yt3.ggpht.com/ytc/AIdro_kqTZ37dPwQf6A-i1Nv8qA8h0ph86PcX6xG2-MbjN7gNXM=s88-c-k-c0x00ffffff-no-rj,https://www.youtube.com/channel/UCy6NdzxY3vrDkFS9d2j4vMQ,0,0,comment
UgzNjantRXLdlnzGKqx4AaABAg,"7:00 Sayangnya orang yg kerjasama sama lu ga pake isi kepalanya juga ya bang? Soalnya dia terjebak di oposisi biner yg nuduh² diserang buzzer setelah banyak yg hujat dia.","1 year ago",2025-06-22T11:53:11.348Z,@Anonymous-iv6pp,UC6rV59gz8963tq2CeRwrujw,0,0,https://yt3.ggpht.com/ytc/AIdro_nmtsXDHjV3vsi3WJxNLeR6_m62bNa4V324lnRtnFy0u-rpS5RDcRIx863T-hajBZ4JOA=s88-c-k-c0x00ffffff-no-rj,https://www.youtube.com/channel/UC6rV59gz8963tq2CeRwrujw,6,2,comment
UgzRwwXvz7YoN60A8Il4AaABAg,"Makasih mas fer atas edukasi nya..salam sehat sll dan teruslah menge dukasi masyarakat 👍","1 year ago",2025-06-22T11:53:11.348Z,@henrysparningotantampubolo9147,UCRsTSa2QjgVoSNrmRmq5ptg,0,0,https://yt3.ggpht.com/ytc/AIdro_kh_KH0pxvRlg9oLAmz9U3Wn066ZC8fTNyjK9eht8Zu5vSB=s88-c-k-c0x00ffffff-no-rj,https://www.youtube.com/channel/UCRsTSa2QjgVoSNrmRmq5ptg,0,0,comment
UgyclQ6sH2-QlO_b2bZ4AaABAg,"Bahas pagar laut dan pik 2 dong, bosan ah makan siang gratis mulu","1 year ago",2025-06-22T11:53:11.348Z,@YayaJiwa-j8h,UC_FnlFWbNTPrmJBhsbKzezg,0,0,https://yt3.ggpht.com/ytc/AIdro_mSi5BW_UR2q8H6RFJy5Nwoke9jMicBTlHyByHhyDaAQggqAB1VERuCiB4qTCrFpbzqCw=s88-c-k-c0x00ffffff-no-rj,https://www.youtube.com/channel/UC_FnlFWbNTPrmJBhsbKzezg,1,0,comment
